{
  "schema_version": 1,
  "latest": "2027/03.json",
  "races": [
    {
      "season": 2027,
      "round": 1,
      "path": "2027/01.json",
      "data_cutoff": "2027-03-13T16:00:00Z",
      "model_version": "simulator-0.9.0",
      "n_drivers": 20,
      "score": {
        "brier_win": 0.042153,
        "brier_podium": 0.099067,
        "brier_top10": 0.182172,
        "log_loss": 2.870512,
        "rps": 0.1319,
        "scored_at": "2027-03-15T18:00:00Z"
      },
      "event_name": "Opening Grand Prix"
    },
    {
      "season": 2027,
      "round": 2,
      "path": "2027/02.json",
      "data_cutoff": "2027-03-27T16:00:00Z",
      "model_version": "simulator-0.9.0",
      "n_drivers": 20,
      "score": {
        "brier_win": 0.047673,
        "brier_podium": 0.105008,
        "brier_top10": 0.214232,
        "log_loss": 2.970324,
        "rps": 0.142285,
        "scored_at": "2027-03-29T18:00:00Z"
      },
      "event_name": "Harbour Grand Prix"
    },
    {
      "season": 2027,
      "round": 3,
      "path": "2027/03.json",
      "data_cutoff": "2027-04-10T16:00:00Z",
      "model_version": "simulator-0.9.0",
      "n_drivers": 20,
      "score": null,
      "event_name": "Desert Grand Prix"
    }
  ],
  "calibration": {
    "races_scored": 2,
    "forecasts": 40,
    "events": [
      {
        "event": "win",
        "label": "Win",
        "bins": [
          {
            "low": 0.0,
            "high": 0.1,
            "mean_forecast": 0.043375,
            "observed": 0.027778,
            "count": 36
          },
          {
            "low": 0.1,
            "high": 0.2,
            "mean_forecast": 0.109625,
            "observed": 0.25,
            "count": 4
          }
        ]
      },
      {
        "event": "podium",
        "label": "Podium",
        "bins": [
          {
            "low": 0.0,
            "high": 0.1,
            "mean_forecast": 0.064344,
            "observed": 0.0,
            "count": 16
          },
          {
            "low": 0.1,
            "high": 0.2,
            "mean_forecast": 0.152154,
            "observed": 0.076923,
            "count": 13
          },
          {
            "low": 0.2,
            "high": 0.3,
            "mean_forecast": 0.25075,
            "observed": 0.375,
            "count": 8
          },
          {
            "low": 0.3,
            "high": 0.4,
            "mean_forecast": 0.328833,
            "observed": 0.666667,
            "count": 3
          }
        ]
      },
      {
        "event": "top10",
        "label": "Points",
        "bins": [
          {
            "low": 0.2,
            "high": 0.3,
            "mean_forecast": 0.253278,
            "observed": 0.333333,
            "count": 9
          },
          {
            "low": 0.3,
            "high": 0.4,
            "mean_forecast": 0.353417,
            "observed": 0.166667,
            "count": 6
          },
          {
            "low": 0.4,
            "high": 0.5,
            "mean_forecast": 0.455417,
            "observed": 0.333333,
            "count": 6
          },
          {
            "low": 0.5,
            "high": 0.6,
            "mean_forecast": 0.5548,
            "observed": 0.4,
            "count": 5
          },
          {
            "low": 0.6,
            "high": 0.7,
            "mean_forecast": 0.664333,
            "observed": 1.0,
            "count": 6
          },
          {
            "low": 0.7,
            "high": 0.8,
            "mean_forecast": 0.756429,
            "observed": 0.714286,
            "count": 7
          },
          {
            "low": 0.8,
            "high": 0.9,
            "mean_forecast": 0.8125,
            "observed": 1.0,
            "count": 1
          }
        ]
      }
    ]
  }
}
